{
  "$schema": "https://json-schema.org/draft/2020-12/schema",
  "$id": "https://github.com/ricoberger/new-shores/content/schema/needs.schema.json",
  "title": "Needs",
  "description": "Needs per tier (CONTENT §2, §11, MECHANICS §6.2). A need is either a goods need (a category with acceptable goods) or a building need (services, D-056: the public buildings of the tier or below that serve the house within their service radius, buildings.json service levels). Every acceptable good and every building alternative has a share (D-056): category coverage = min(1, sum of the shares of the supplied alternatives x their supply ratio). The share is optional: when absent the loader uses 1.0 for a lone alternative and 0.6 for each of two or more; an authored share wins. kind: required needs count toward satisfaction (own-tier required weights sum to 1; see from_tier for lower-tier categories); optional needs are shown but have no effect (the optional tax bonus was removed by D-056). name is the player-facing name (1–32 printable characters; display data only); a goods need's category must be listed in need_categories.json.",
  "type": "array",
  "items": {
    "type": "object",
    "additionalProperties": false,
    "required": ["id", "name", "tier", "weight", "kind"],
    "properties": {
      "id": { "$ref": "#/$defs/id" },
      "name": { "type": "string", "minLength": 1, "maxLength": 32 },
      "tier": { "$ref": "#/$defs/id" },
      "from_tier": {
        "$ref": "#/$defs/id",
        "description": "Cumulative tiers (D-056): set on a lower tier's goods category carried by this tier; per_resident_per_min is the lower rate and weight the category's weight in from_tier. The loader normalises the weights: the tier's own categories share 0.6, the lower tiers 0.4 (equally per tier, then by weight)."
      },
      "weight": { "type": "number", "exclusiveMinimum": 0, "maximum": 1 },
      "kind": { "enum": ["required", "optional"] },
      "category": { "$ref": "#/$defs/id" },
      "goods": {
        "type": "array",
        "minItems": 1,
        "items": {
          "type": "object",
          "additionalProperties": false,
          "required": ["good", "per_resident_per_min"],
          "properties": {
            "good": { "$ref": "#/$defs/id" },
            "per_resident_per_min": { "type": "number", "exclusiveMinimum": 0 },
            "share": { "$ref": "#/$defs/share" }
          }
        }
      },
      "buildings": {
        "type": "array",
        "minItems": 1,
        "items": {
          "type": "object",
          "additionalProperties": false,
          "required": ["building"],
          "properties": {
            "building": { "$ref": "#/$defs/id" },
            "share": { "$ref": "#/$defs/share" }
          }
        }
      }
    },
    "oneOf": [
      {
        "required": ["category", "goods"],
        "not": { "required": ["buildings"] }
      },
      {
        "required": ["buildings"],
        "not": { "anyOf": [{ "required": ["goods"] }, { "required": ["from_tier"] }] }
      }
    ]
  },
  "$defs": {
    "id": { "type": "string", "pattern": "^[a-z][a-z0-9_]*$" },
    "share": {
      "description": "Coverage contributed by this alternative at full supply (D-056; default 1.0 for a lone alternative, 0.6 otherwise).",
      "type": "number",
      "exclusiveMinimum": 0,
      "maximum": 1
    }
  }
}
