[
  {
    "id": "settlers_food",
    "name": "Food",
    "tier": "settlers",
    "kind": "required",
    "weight": 0.5,
    "category": "food",
    "goods": [
      { "good": "fish", "per_resident_per_min": 0.010 },
      { "good": "bread", "per_resident_per_min": 0.008 }
    ]
  },
  {
    "id": "settlers_clothing",
    "name": "Clothing",
    "tier": "settlers",
    "kind": "required",
    "weight": 0.2,
    "category": "clothing",
    "goods": [{ "good": "wool_garments", "per_resident_per_min": 0.005 }]
  },
  {
    "id": "settlers_market_small",
    "name": "Market",
    "tier": "settlers",
    "kind": "required",
    "weight": 0.3,
    "buildings": [{ "building": "market_small" }]
  },
  {
    "id": "settlers_chapel",
    "name": "Chapel",
    "tier": "settlers",
    "kind": "optional",
    "weight": 0.5,
    "buildings": [{ "building": "chapel" }]
  },
  {
    "id": "citizens_food",
    "name": "Food",
    "tier": "citizens",
    "kind": "required",
    "weight": 0.5,
    "category": "food",
    "goods": [{ "good": "bread", "per_resident_per_min": 0.008 }]
  },
  {
    "id": "citizens_market_small",
    "name": "Market",
    "tier": "citizens",
    "kind": "required",
    "weight": 0.5,
    "buildings": [{ "building": "market_small" }]
  }
]
